<?xml version="1.0"?>
<!DOCTYPE database SYSTEM "DatabaseDefinition.dtd">
<!--                                                                                  -->
<!-- Copyright 2002-2022 Echo Three, LLC                                              -->
<!--                                                                                  -->
<!-- Licensed under the Apache License, Version 2.0 (the "License");                  -->
<!-- you may not use this file except in compliance with the License.                 -->
<!-- You may obtain a copy of the License at                                          -->
<!--                                                                                  -->
<!--     http://www.apache.org/licenses/LICENSE-2.0                                   -->
<!--                                                                                  -->
<!-- Unless required by applicable law or agreed to in writing, software              -->
<!-- distributed under the License is distributed on an "AS IS" BASIS,                -->
<!-- WITHOUT WARRANTIES OR CONDITIONS OF ANY KIND, either express or implied.         -->
<!-- See the License for the specific language governing permissions and              -->
<!-- limitations under the License.                                                   -->
<!--                                                                                  -->
<database name="echothree">
    <components>
        <component name="Survey">
            <tables>
                <table namePlural="SurveyTypes" nameSingular="SurveyType" columnPrefix="srvytyp">
                    <columns>
                        <column name="SurveyTypeId" type="EID" nullAllowed="false" />
                        <column name="ChainKindId" type="ForeignKey" nullAllowed="false" onParentDelete="delete" destinationTable="ChainKinds" destinationColumn="ChainKindId" />
                        <column name="SurveyTypeName" type="Name" nullAllowed="false" />
                        <column name="SortOrder" type="Integer" nullAllowed="false" />
                    </columns>
                    <indexes>
                        <index type="PrimaryKey">
                            <indexColumn name="SurveyTypeId" />
                        </index>
                        <index type="Unique" name="Index1">
                            <indexColumn name="ChainKindId" />
                            <indexColumn name="SurveyTypeName" />
                        </index>
                    </indexes>
                </table>
                <table namePlural="SurveyTypeDescriptions" nameSingular="SurveyTypeDescription" columnPrefix="srvytypd">
                    <columns>
                        <column name="SurveyTypeDescriptionId" type="EID" nullAllowed="false" />
                        <column name="SurveyTypeId" type="ForeignKey" nullAllowed="false" onParentDelete="delete" destinationTable="SurveyTypes" destinationColumn="SurveyTypeId" />
                        <column name="LanguageId" type="ForeignKey" nullAllowed="false" onParentDelete="delete" destinationTable="Languages" destinationColumn="LanguageId" />
                        <column name="Description" type="Description" nullAllowed="false" />
                    </columns>
                    <indexes>
                        <index type="PrimaryKey">
                            <indexColumn name="SurveyTypeDescriptionId" />
                        </index>
                        <index type="Unique" name="Index1">
                            <indexColumn name="SurveyTypeId" />
                            <indexColumn name="LanguageId" />
                        </index>
                        <index type="Multiple">
                            <indexColumn name="LanguageId" />
                        </index>
                    </indexes>
                </table>
                <table namePlural="Surveys" nameSingular="Survey" columnPrefix="srvy">
                    <columns>
                        <column name="SurveyId" type="EID" nullAllowed="false" />
                        <column name="ActiveDetailId" type="ForeignKey" nullAllowed="true" onParentDelete="delete" destinationTable="SurveyDetails" destinationColumn="SurveyDetailId"/>
                        <column name="LastDetailId" type="ForeignKey" nullAllowed="true" onParentDelete="delete" destinationTable="SurveyDetails" destinationColumn="SurveyDetailId"/>
                    </columns>
                    <indexes>
                        <index type="PrimaryKey">
                            <indexColumn name="SurveyId" />
                        </index>
                        <index type="Unique">
                            <indexColumn name="ActiveDetailId" />
                        </index>
                        <index type="Unique">
                            <indexColumn name="LastDetailId" />
                        </index>
                    </indexes>
                </table>
                <table namePlural="SurveyDetails" nameSingular="SurveyDetail" columnPrefix="srvydt">
                    <columns>
                        <column name="SurveyDetailId" type="EID" nullAllowed="false" />
                        <column name="SurveyId" type="ForeignKey" nullAllowed="false" onParentDelete="delete" destinationTable="Surveys" destinationColumn="SurveyId" />
                        <column name="SurveyTypeId" type="ForeignKey" nullAllowed="false" onParentDelete="delete" destinationTable="SurveyTypes" destinationColumn="SurveyTypeId" />
                        <column name="SurveyName" type="Name" nullAllowed="false" />
                        <column name="IsDefault" type="Boolean" nullAllowed="false" />
                        <column name="SortOrder" type="Integer" nullAllowed="false" />
                        <column name="FromTime" type="Time" nullAllowed="false" />
                        <column name="ThruTime" type="Time" nullAllowed="false" />
                    </columns>
                    <indexes>
                        <index type="PrimaryKey">
                            <indexColumn name="SurveyDetailId" />
                        </index>
                        <index type="Unique" name="Index1">
                            <indexColumn name="SurveyId" />
                            <indexColumn name="ThruTime" />
                        </index>
                        <index type="Multiple" name="Index2">
                            <indexColumn name="SurveyTypeId" />
                            <indexColumn name="ThruTime" />
                        </index>
                        <index type="Unique" name="Index3">
                            <indexColumn name="SurveyTypeId" />
                            <indexColumn name="SurveyName" />
                            <indexColumn name="ThruTime" />
                        </index>
                        <index type="Multiple" name="Index4">
                            <indexColumn name="SurveyTypeId" />
                            <indexColumn name="IsDefault" />
                            <indexColumn name="ThruTime" />
                        </index>
                    </indexes>
                </table>
                <table namePlural="SurveyDescriptions" nameSingular="SurveyDescription" columnPrefix="srvyd">
                    <columns>
                        <column name="SurveyDescriptionId" type="EID" nullAllowed="false" />
                        <column name="SurveyId" type="ForeignKey" nullAllowed="false" onParentDelete="delete" destinationTable="Surveys" destinationColumn="SurveyId" />
                        <column name="LanguageId" type="ForeignKey" nullAllowed="false" onParentDelete="delete" destinationTable="Languages" destinationColumn="LanguageId" />
                        <column name="Description" type="Description" nullAllowed="false" />
                        <column name="FromTime" type="Time" nullAllowed="false" />
                        <column name="ThruTime" type="Time" nullAllowed="false" />
                    </columns>
                    <indexes>
                        <index type="PrimaryKey">
                            <indexColumn name="SurveyDescriptionId" />
                        </index>
                        <index type="Unique" name="Index1">
                            <indexColumn name="SurveyId" />
                            <indexColumn name="LanguageId" />
                            <indexColumn name="ThruTime" />
                        </index>
                        <index type="Multiple" name="Index2">
                            <indexColumn name="LanguageId" />
                            <indexColumn name="ThruTime" />
                        </index>
                    </indexes>
                </table>
            </tables>
        </component>
    </components>
</database>
