<?xml version="1.0"?>
<!DOCTYPE database SYSTEM "DatabaseDefinition.dtd">
<!--                                                                                  -->
<!-- Copyright 2002-2018 Echo Three, LLC                                              -->
<!--                                                                                  -->
<!-- Licensed under the Apache License, Version 2.0 (the "License");                  -->
<!-- you may not use this file except in compliance with the License.                 -->
<!-- You may obtain a copy of the License at                                          -->
<!--                                                                                  -->
<!--     http://www.apache.org/licenses/LICENSE-2.0                                   -->
<!--                                                                                  -->
<!-- Unless required by applicable law or agreed to in writing, software              -->
<!-- distributed under the License is distributed on an "AS IS" BASIS,                -->
<!-- WITHOUT WARRANTIES OR CONDITIONS OF ANY KIND, either express or implied.         -->
<!-- See the License for the specific language governing permissions and              -->
<!-- limitations under the License.                                                   -->
<!--                                                                                  -->
<database name="echothree">
    <components>
        <component name="License">
            <tables>
                <table namePlural="LicenseTypes" nameSingular="LicenseType" columnPrefix="lcnstyp">
                    <columns>
                        <column name="LicenseTypeId" type="EID" nullAllowed="false" />
                        <column name="ActiveDetailId" type="ForeignKey" nullAllowed="true" onParentDelete="delete" destinationTable="LicenseTypeDetails" destinationColumn="LicenseTypeDetailId"/>
                        <column name="LastDetailId" type="ForeignKey" nullAllowed="true" onParentDelete="delete" destinationTable="LicenseTypeDetails" destinationColumn="LicenseTypeDetailId"/>
                    </columns>
                    <indexes>
                        <index type="PrimaryKey">
                            <indexColumn name="LicenseTypeId" />
                        </index>
                        <index type="Unique">
                            <indexColumn name="ActiveDetailId"/>
                        </index>
                        <index type="Unique">
                            <indexColumn name="LastDetailId"/>
                        </index>
                    </indexes>
                </table>
                <table namePlural="LicenseTypeDetails" nameSingular="LicenseTypeDetail" columnPrefix="lcnstypdt">
                    <columns>
                        <column name="LicenseTypeDetailId" type="EID" nullAllowed="false" />
                        <column name="LicenseTypeId" type="ForeignKey" nullAllowed="false" onParentDelete="delete" destinationTable="LicenseTypes" destinationColumn="LicenseTypeId" />
                        <column name="LicenseTypeName" type="Name" nullAllowed="false" />
                        <column name="IsDefault" type="Boolean" nullAllowed="false" />
                        <column name="SortOrder" type="Integer" nullAllowed="false" />
                        <column name="FromTime" type="Time" nullAllowed="false" />
                        <column name="ThruTime" type="Time" nullAllowed="false" />
                    </columns>
                    <indexes>
                        <index type="PrimaryKey">
                            <indexColumn name="LicenseTypeDetailId" />
                        </index>
                        <index type="Unique" name="Index1">
                            <indexColumn name="LicenseTypeId" />
                            <indexColumn name="ThruTime" />
                        </index>
                        <index type="Unique" name="Index2">
                            <indexColumn name="LicenseTypeName" />
                            <indexColumn name="ThruTime" />
                        </index>
                        <index type="Multiple" name="Index3">
                            <indexColumn name="IsDefault" />
                            <indexColumn name="ThruTime" />
                        </index>
                    </indexes>
                </table>
                <table namePlural="LicenseTypeDescriptions" nameSingular="LicenseTypeDescription" columnPrefix="lcnstypd">
                    <columns>
                        <column name="LicenseTypeDescriptionId" type="EID" nullAllowed="false" />
                        <column name="LicenseTypeId" type="ForeignKey" nullAllowed="false" onParentDelete="delete" destinationTable="LicenseTypes" destinationColumn="LicenseTypeId" />
                        <column name="LanguageId" type="ForeignKey" nullAllowed="false" onParentDelete="delete" destinationTable="Languages" destinationColumn="LanguageId" />
                        <column name="Description" type="Description" nullAllowed="false" />
                        <column name="FromTime" type="Time" nullAllowed="false" />
                        <column name="ThruTime" type="Time" nullAllowed="false" />
                    </columns>
                    <indexes>
                        <index type="PrimaryKey">
                            <indexColumn name="LicenseTypeDescriptionId" />
                        </index>
                        <index type="Unique" name="Index1">
                            <indexColumn name="LicenseTypeId" />
                            <indexColumn name="LanguageId" />
                            <indexColumn name="ThruTime"/>
                        </index>
                        <index type="Multiple" name="Index2">
                            <indexColumn name="LicenseTypeId" />
                            <indexColumn name="ThruTime"/>
                        </index>
                        <index type="Multiple" name="Index3">
                            <indexColumn name="LanguageId" />
                            <indexColumn name="ThruTime"/>
                        </index>
                    </indexes>
                </table>
            </tables>
        </component>
    </components>
</database>
