<?xml version="1.0"?>
<!DOCTYPE database SYSTEM "DatabaseDefinition.dtd">
<!--                                                                                  -->
<!-- Copyright 2002-2018 Echo Three, LLC                                              -->
<!--                                                                                  -->
<!-- Licensed under the Apache License, Version 2.0 (the "License");                  -->
<!-- you may not use this file except in compliance with the License.                 -->
<!-- You may obtain a copy of the License at                                          -->
<!--                                                                                  -->
<!--     http://www.apache.org/licenses/LICENSE-2.0                                   -->
<!--                                                                                  -->
<!-- Unless required by applicable law or agreed to in writing, software              -->
<!-- distributed under the License is distributed on an "AS IS" BASIS,                -->
<!-- WITHOUT WARRANTIES OR CONDITIONS OF ANY KIND, either express or implied.         -->
<!-- See the License for the specific language governing permissions and              -->
<!-- limitations under the License.                                                   -->
<!--                                                                                  -->
<database name="echothree">
    <components>
        <component name="Style">
            <tables>
                <table namePlural="StylePaths" nameSingular="StylePath" columnPrefix="stylpth">
                    <columns>
                        <column name="StylePathId" type="EID" nullAllowed="false" />
                        <column name="ActiveDetailId" type="ForeignKey" nullAllowed="true" onParentDelete="delete" destinationTable="StylePathDetails" destinationColumn="StylePathDetailId"/>
                        <column name="LastDetailId" type="ForeignKey" nullAllowed="true" onParentDelete="delete" destinationTable="StylePathDetails" destinationColumn="StylePathDetailId"/>
                    </columns>
                    <indexes>
                        <index type="PrimaryKey">
                            <indexColumn name="StylePathId" />
                        </index>
                        <index type="Unique">
                            <indexColumn name="ActiveDetailId" />
                        </index>
                        <index type="Unique">
                            <indexColumn name="LastDetailId" />
                        </index>
                    </indexes>
                </table>
                <table namePlural="StylePathDetails" nameSingular="StylePathDetail" columnPrefix="stylpthdt">
                    <columns>
                        <column name="StylePathDetailId" type="EID" nullAllowed="false" />
                        <column name="StylePathId" type="ForeignKey" nullAllowed="false" onParentDelete="delete" destinationTable="StylePaths" destinationColumn="StylePathId" />
                        <column name="StylePathName" type="Name" nullAllowed="false" />
                        <column name="IsDefault" type="Boolean" nullAllowed="false" />
                        <column name="SortOrder" type="Integer" nullAllowed="false" />
                        <column name="FromTime" type="Time" nullAllowed="false" />
                        <column name="ThruTime" type="Time" nullAllowed="false" />
                    </columns>
                    <indexes>
                        <index type="PrimaryKey">
                            <indexColumn name="StylePathDetailId" />
                        </index>
                        <index type="Unique" name="Index1">
                            <indexColumn name="StylePathId" />
                            <indexColumn name="ThruTime" />
                        </index>
                        <index type="Unique" name="Index2">
                            <indexColumn name="StylePathName" />
                            <indexColumn name="ThruTime" />
                        </index>
                        <index type="Multiple" name="Index3">
                            <indexColumn name="IsDefault" />
                            <indexColumn name="ThruTime" />
                        </index>
                    </indexes>
                </table>
                <table namePlural="StylePathDescriptions" nameSingular="StylePathDescription" columnPrefix="stylpthd">
                    <columns>
                        <column name="StylePathDescriptionId" type="EID" nullAllowed="false" />
                        <column name="StylePathId" type="ForeignKey" nullAllowed="false" onParentDelete="delete" destinationTable="StylePaths" destinationColumn="StylePathId" />
                        <column name="LanguageId" type="ForeignKey" nullAllowed="false" onParentDelete="delete" destinationTable="Languages" destinationColumn="LanguageId" />
                        <column name="Description" type="Description" nullAllowed="false" />
                        <column name="FromTime" type="Time" nullAllowed="false" />
                        <column name="ThruTime" type="Time" nullAllowed="false" />
                    </columns>
                    <indexes>
                        <index type="PrimaryKey">
                            <indexColumn name="StylePathDescriptionId" />
                        </index>
                        <index type="Unique" name="Index1">
                            <indexColumn name="StylePathId" />
                            <indexColumn name="LanguageId" />
                            <indexColumn name="ThruTime" />
                        </index>
                        <index type="Multiple" name="Index2">
                            <indexColumn name="LanguageId" />
                            <indexColumn name="ThruTime" />
                        </index>
                    </indexes>
                </table>
            </tables>
        </component>
    </components>
</database>
